Men_Health;Women_Health;Nutrition;Health_Conditions;Pharmacy
how to circumcision;how to get rid of yeast infection;how to lose weight;how to sleep;how to get prescription
how to lower testosterone;how to delay period;how to gain weight;how to lower blood pressure;how to take tablets
how to increase testosterone;how to relieve period cramps fast;how to lower cholesterol;how to reduce swelling;how to get adderall
how to erect penis;how to strengthen pelvic floor;how many calories to lose weight;how to keto diet;how to take antibiotics
how to cure premature ejaculation;how to reduce menstrual pain ;how to digest food;how to get rid of hiccups;how to take ciprofloxacin
how to shrink prostate;how to bring periods;how to meal plan;how to stop snoring;how to take keto pills
how to prevent erectile dysfunction;how to soften your cervix;how to calculate calories;how to stop itching;how to administer trulicity
how to treat impotence;how to ease labor pain;how to lower ldl;how to stop diarrhea;how to take amoxicillin
how to stretch foreskin fast;how to manage pcos;how to lower triglycerides;how to treat a burn;how to take ibuprofen
how to lower shbg;how to delay menopause;how many calories to eat a day;how to clean ears;how to get viagra
what is prostate;what is discharge;what is vitamin c;what is cancer;what is ibuprofen
what is psa;what is uterus;what is protein;what is diabetes;what is antibiotic
what is prostate cancer;what is vaginal;what is calories;what is hiv;what is amoxicillin
what is testosterone;what is endometriosis;what is nutrition;what is normal blood pressure;what is tramadol
what is erectile dysfunction;what is menopause;what is carbs;what is arthritis;what is viagra
what is circumcision;what is cyst;what is cholesterol;what is insulin;what is xanax
what is semen;what is yeast infection;what is vitamin d;what is high blood pressure;what is doxycycline
what is pd;what is amenorrhea;what is keto;what is hepatitis;what is adderall
what is normal psa;what is pcos;what is calcium;what is sepsis;what is aspirin
what is foreskin;what is periods;what is gluten;what is anemia;what is tylenol
